{
  "$schema": "./ui-spec.schema.json",
  "tab": "system_r05",
  "version": "r05",
  "jsonRoot": "system_conf",
  "generatedFrom": "_export_system_r05",
  "entryCount": 34,
  "entries": [
    {
      "id": "system_conf.lan_ip_address.lan_ip_addr.assignment",
      "sourceRows": {
        "ja": 12,
        "en": 13
      },
      "ui": {
        "screen": {
          "en": "LAN-side IP Address",
          "ja": "LAN側IPアドレス"
        },
        "no": 1,
        "label": {
          "en": "IP Address Assignment",
          "ja": "IPアドレス割り当て"
        },
        "inputType": "dropdown",
        "default": "DHCPクライアント",
        "range": "固定IPアドレス/DHCPクライアント",
        "lsb": null,
        "required": true,
        "validation": "なし",
        "comment": {
          "en": null,
          "ja": null
        }
      },
      "json": {
        "path": [
          "system_conf",
          "lan_ip_address",
          "lan_ip_addr",
          "assignment"
        ],
        "item": {
          "en": null,
          "ja": "IPアドレス割り当て"
        },
        "type": "string",
        "default": "dhcp",
        "minimum": null,
        "maximum": null,
        "required": false,
        "enum": [
          "dhcp",
          "static"
        ],
        "enumName": [
          "DHCPクライアント",
          "静的IPアドレス"
        ],
        "format": null,
        "pattern": null,
        "description": {
          "en": null,
          "ja": null
        },
        "readOnly": false
      }
    },
    {
      "id": "system_conf.lan_ip_address.lan_ip_addr.ipv4addr",
      "sourceRows": {
        "ja": 14,
        "en": 15
      },
      "ui": {
        "screen": {
          "en": null,
          "ja": null
        },
        "no": 2,
        "label": {
          "en": "IP Address",
          "ja": "IPアドレス"
        },
        "inputType": "textbox",
        "default": "（空白）",
        "range": null,
        "lsb": null,
        "required": true,
        "validation": "あり*1",
        "comment": {
          "en": "*1：According to IPv4 Address format",
          "ja": "*1：IPv4アドレス形式"
        }
      },
      "json": {
        "path": [
          "system_conf",
          "lan_ip_address",
          "lan_ip_addr",
          "ipv4addr"
        ],
        "item": {
          "en": null,
          "ja": "IPアドレス"
        },
        "type": "string",
        "default": "192.168.3.1",
        "minimum": null,
        "maximum": null,
        "required": false,
        "enum": null,
        "enumName": null,
        "format": "ipv4",
        "pattern": null,
        "description": {
          "en": null,
          "ja": "IPアドレス割り当てがDHCPの場合は入力不要です。"
        },
        "readOnly": false
      }
    },
    {
      "id": "system_conf.lan_ip_address.lan_ip_addr.subnet",
      "sourceRows": {
        "ja": 16,
        "en": 17
      },
      "ui": {
        "screen": {
          "en": null,
          "ja": null
        },
        "no": 3,
        "label": {
          "en": "Subnet Mask",
          "ja": "サブネットマスク"
        },
        "inputType": "textbox",
        "default": "（空白）",
        "range": null,
        "lsb": null,
        "required": true,
        "validation": "あり*2",
        "comment": {
          "en": "*2：According to Subnet Mask format",
          "ja": "*2：サブネットマスク形式"
        }
      },
      "json": {
        "path": [
          "system_conf",
          "lan_ip_address",
          "lan_ip_addr",
          "subnet"
        ],
        "item": {
          "en": null,
          "ja": "サブネットマスク"
        },
        "type": "string",
        "default": "255.255.255.0",
        "minimum": null,
        "maximum": null,
        "required": false,
        "enum": null,
        "enumName": null,
        "format": "ipv4",
        "pattern": null,
        "description": {
          "en": null,
          "ja": "IPアドレス割り当てがDHCPの場合は入力不要です。"
        },
        "readOnly": false
      }
    },
    {
      "id": "system_conf.lan_ip_address.lan_ip_addr.dgw",
      "sourceRows": {
        "ja": 18,
        "en": 19
      },
      "ui": {
        "screen": {
          "en": null,
          "ja": null
        },
        "no": 4,
        "label": {
          "en": "Default Gateway",
          "ja": "デフォルトゲートウェイ"
        },
        "inputType": "dropdown",
        "default": "DHCP",
        "range": "ユーザー定義/DHCP",
        "lsb": null,
        "required": true,
        "validation": "なし",
        "comment": {
          "en": null,
          "ja": null
        }
      },
      "json": {
        "path": [
          "system_conf",
          "lan_ip_address",
          "lan_ip_addr",
          "dgw"
        ],
        "item": {
          "en": null,
          "ja": "デフォルトゲートウェイ"
        },
        "type": "string",
        "default": "dhcp",
        "minimum": null,
        "maximum": null,
        "required": false,
        "enum": [
          "dhcp",
          "user"
        ],
        "enumName": [
          "DHCP",
          "ユーザー定義"
        ],
        "format": null,
        "pattern": null,
        "description": {
          "en": null,
          "ja": null
        },
        "readOnly": false
      }
    },
    {
      "id": "system_conf.lan_ip_address.lan_ip_addr.dgw_ipv4addr",
      "sourceRows": {
        "ja": 20,
        "en": 21
      },
      "ui": {
        "screen": {
          "en": null,
          "ja": null
        },
        "no": 5,
        "label": {
          "en": "Default Gateway IP Address",
          "ja": "デフォルトゲートウェイIPアドレス"
        },
        "inputType": "textbox",
        "default": "（空白）",
        "range": null,
        "lsb": null,
        "required": true,
        "validation": "あり*1",
        "comment": {
          "en": null,
          "ja": null
        }
      },
      "json": {
        "path": [
          "system_conf",
          "lan_ip_address",
          "lan_ip_addr",
          "dgw_ipv4addr"
        ],
        "item": {
          "en": null,
          "ja": "デフォルトゲートウェイIPアドレス"
        },
        "type": "string",
        "default": "0.0.0.0",
        "minimum": null,
        "maximum": null,
        "required": false,
        "enum": null,
        "enumName": null,
        "format": "ipv4",
        "pattern": null,
        "description": {
          "en": null,
          "ja": "デフォルトゲートウェイがDHCPの場合は入力不要です。"
        },
        "readOnly": false
      }
    },
    {
      "id": "system_conf.lan_ip_address.lan_ip_addr.dns_assignment",
      "sourceRows": {
        "ja": 22,
        "en": 23
      },
      "ui": {
        "screen": {
          "en": null,
          "ja": null
        },
        "no": 6,
        "label": {
          "en": "DNS Primary",
          "ja": "DNSプライマリ"
        },
        "inputType": "dropdown",
        "default": "DHCP",
        "range": "ユーザー定義/DHCP",
        "lsb": null,
        "required": true,
        "validation": "なし",
        "comment": {
          "en": null,
          "ja": null
        }
      },
      "json": {
        "path": [
          "system_conf",
          "lan_ip_address",
          "lan_ip_addr",
          "dns_assignment"
        ],
        "item": {
          "en": null,
          "ja": "DNSサーバーアドレス指定方法"
        },
        "type": "string",
        "default": "dhcp",
        "minimum": null,
        "maximum": null,
        "required": false,
        "enum": [
          "dhcp",
          "user"
        ],
        "enumName": [
          "DHCP",
          "ユーザー定義"
        ],
        "format": null,
        "pattern": null,
        "description": {
          "en": null,
          "ja": null
        },
        "readOnly": false
      }
    },
    {
      "id": "system_conf.lan_ip_address.lan_ip_addr.primary_ipv4addr",
      "sourceRows": {
        "ja": 24,
        "en": 25
      },
      "ui": {
        "screen": {
          "en": null,
          "ja": null
        },
        "no": 7,
        "label": {
          "en": "DNS Primary IP Address",
          "ja": "DNSプライマリIPアドレス"
        },
        "inputType": "textbox",
        "default": "（空白）",
        "range": null,
        "lsb": null,
        "required": true,
        "validation": "あり*1",
        "comment": {
          "en": null,
          "ja": null
        }
      },
      "json": {
        "path": [
          "system_conf",
          "lan_ip_address",
          "lan_ip_addr",
          "primary_ipv4addr"
        ],
        "item": {
          "en": null,
          "ja": "プライマリアドレス"
        },
        "type": "string",
        "default": "0.0.0.0",
        "minimum": null,
        "maximum": null,
        "required": false,
        "enum": null,
        "enumName": null,
        "format": "ipv4",
        "pattern": null,
        "description": {
          "en": null,
          "ja": "アドレス指定方法がDHCPの場合は入力不要です。"
        },
        "readOnly": false
      }
    },
    {
      "id": "system_conf.lan_ip_address.lan_ip_addr.secondary_ipv4addr",
      "sourceRows": {
        "ja": 26,
        "en": 27
      },
      "ui": {
        "screen": {
          "en": null,
          "ja": null
        },
        "no": 8,
        "label": {
          "en": "DNS Secondary IP Address",
          "ja": "DNSセカンダリIPアドレス"
        },
        "inputType": "textbox",
        "default": "（空白）",
        "range": null,
        "lsb": null,
        "required": true,
        "validation": "あり*1",
        "comment": {
          "en": null,
          "ja": null
        }
      },
      "json": {
        "path": [
          "system_conf",
          "lan_ip_address",
          "lan_ip_addr",
          "secondary_ipv4addr"
        ],
        "item": {
          "en": null,
          "ja": "セカンダリアドレス"
        },
        "type": "string",
        "default": "0.0.0.0",
        "minimum": null,
        "maximum": null,
        "required": false,
        "enum": null,
        "enumName": null,
        "format": "ipv4",
        "pattern": null,
        "description": {
          "en": null,
          "ja": "アドレス指定方法がDHCPの場合は入力不要です。"
        },
        "readOnly": false